{
  "$schema": "https://json-schema.org/draft/2020-12/schema",
  "$id": "https://mpp/config_schemas/routing_table.schema.json",
  "title": "ROUTING_TABLE config payload (ConfigEntityType.CONFIG_ENTITY_TYPE_ROUTING_TABLE)",
  "description": "Per-operator таблица маршрутов. Routing stage выбирает route+protocol уже ВНУТРИ известного оператора (Destination Resolution отработал раньше) — hld.md §11. Протокольные механические параметры (bind, retry) живут в OPERATOR (operator.schema.json); здесь — только выбор маршрута и его пропускная способность. Только один route активен одновременно на operator (hld.md: 'рейт лимитить два канала сразу не нужно') — это active_route_id, не флаг на каждом route.",
  "type": "object",
  "additionalProperties": false,
  "required": ["operator_id", "version", "status", "active_route_id", "routes"],
  "properties": {
    "operator_id": { "type": "string" },
    "version": { "type": "integer", "minimum": 1 },
    "status": { "enum": ["active", "archived"] },
    "active_route_id": {
      "description": "route_id из routes[], который сейчас реально принимает трафик. Должен присутствовать в routes.",
      "type": "string"
    },
    "routes": {
      "type": "array",
      "minItems": 1,
      "items": { "$ref": "#/$defs/route" }
    }
  },
  "$defs": {
    "route": {
      "type": "object",
      "additionalProperties": false,
      "required": ["route_id", "protocol", "failover_priority", "tps_limit"],
      "properties": {
        "route_id": { "type": "string" },
        "protocol": { "enum": ["SMPP", "HTTP"] },
        "failover_priority": {
          "description": "1 = пробуется первым при failover от active_route_id. Уникален внутри routes[].",
          "type": "integer",
          "minimum": 1
        },
        "tps_limit": {
          "description": "Может отличаться от tps_limit в OPERATOR-профиле того же протокола — резервный канал часто держат на меньшей квоте.",
          "type": "integer",
          "exclusiveMinimum": 0
        }
      }
    }
  }
}
