{
  "operator_id": "beeline_uz",
  "version": 3,
  "status": "active",
  "active_route_id": "beeline_smpp_primary",
  "routes": [
    { "route_id": "beeline_smpp_primary", "protocol": "SMPP", "failover_priority": 1, "tps_limit": 500 },
    { "route_id": "beeline_http_reserve", "protocol": "HTTP", "failover_priority": 2, "tps_limit": 200 }
  ]
}
